code,name,slug,province_code,regency_code,contact_name,contact_phone
pdam-balikpapan,Perumda Tirta Manuntung Balikpapan,perumda-tirta-manuntung-balikpapan,64,64.71,Admin Balikpapan,081200000001
pdam-samarinda,Perumdam Tirta Kencana Samarinda,perumdam-tirta-kencana-samarinda,64,64.72,Admin Samarinda,081200000002
pdam-bontang,Perumda Tirta Taman Bontang,perumda-tirta-taman-bontang,64,64.74,Admin Bontang,081200000003
pdam-kutai-kartanegara,Perumda Tirta Mahakam Kutai Kartanegara,perumda-tirta-mahakam-kutai-kartanegara,64,64.02,Admin Kukar,081200000004
pdam-berau,Perumda Batiwakkal Berau,perumda-batiwakkal-berau,64,64.03,Admin Berau,081200000005
pdam-makassar,Perumda Air Minum Kota Makassar,perumda-air-minum-kota-makassar,73,73.71,Admin Makassar,081200000006
pdam-surabaya,PDAM Surya Sembada Surabaya,pdam-surya-sembada-surabaya,35,35.78,Admin Surabaya,081200000007
pdam-bandung,Perumda Tirtawening Kota Bandung,perumda-tirtawening-kota-bandung,32,32.73,Admin Bandung,081200000008
